{
  "schemaVersion": 1,
  "packID": "8f794466-5f2f-4fd1-9ad2-185513737b9f",
  "packSlug": "foundation.de-en",
  "packVersion": "1.1.0",
  "title": "DogCoach Foundation",
  "author": "DogCoach Studio",
  "license": "Copyright DogCoach Studio. All rights reserved.",
  "reviewStatus": "approved",
  "minimumAppVersion": "0.1.0",
  "methodologyNote": "Reward-based, low-risk foundation exercises. No diagnosis, treatment claim, or guaranteed outcome.",
  "exercises": [
    {
      "id": "1da3ac99-f1d0-48f5-aedf-83e0f37e9e81",
      "version": 2,
      "metadata": {
        "categories": ["orientation", "foundation"],
        "difficulty": "foundation",
        "durationMinutes": 5,
        "equipment": ["small food rewards"],
        "safetyLevel": "standard"
      },
      "localizations": {
        "de": {
          "title": "Freiwillige Orientierung",
          "goal": "Der Hund wendet sich in einer ruhigen Situation freiwillig dem Menschen zu.",
          "setup": "Reizarmer Ort, lockere Leine und griffbereite kleine Belohnungen.",
          "steps": [
            "Ruhig stehen und dem Hund Zeit geben, die Umgebung wahrzunehmen.",
            "Jede freiwillige Blick- oder Körperorientierung zum Menschen ruhig markieren.",
            "Die Belohnung nah beim Menschen geben und anschließend wieder Wahlfreiheit lassen."
          ],
          "successCriteria": [
            "Der Hund orientiert sich innerhalb von 30 Sekunden mindestens dreimal freiwillig um.",
            "Die Leine bleibt überwiegend locker."
          ],
          "commonErrors": ["Den Hund dauerhaft ansprechen", "Orientierung über die Leine heranziehen"],
          "correctiveMeasures": ["Still werden, warten und bereits kleine freiwillige Wendungen markieren.", "Leine entlasten, Abstand vergrößern und die Orientierung als freie Entscheidung neu anbieten."],
          "regression": "Abstand zu Ablenkungen vergrößern und die Einheit verkürzen.",
          "progression": "Kurze Wiederholungen an einem leicht belebteren Ort durchführen.",
          "homework": "Einmal täglich eine ruhige Minute beobachten und freiwillige Orientierung belohnen.",
          "safetyNotes": "So viel Abstand wählen, dass Hund und Mensch ruhig handeln können.",
          "reviewStatus": "approved"
        },
        "en": {
          "title": "Voluntary orientation",
          "goal": "The dog voluntarily turns toward the handler in a calm setting.",
          "setup": "Low-distraction area, loose lead, and small rewards ready to use.",
          "steps": [
            "Stand calmly and allow the dog time to observe the environment.",
            "Calmly mark each voluntary glance or body turn toward the handler.",
            "Deliver the reward near the handler, then offer freedom to choose again."
          ],
          "successCriteria": [
            "The dog voluntarily reorients at least three times within 30 seconds.",
            "The lead remains mostly loose."
          ],
          "commonErrors": ["Calling the dog continuously", "Pulling orientation through the lead"],
          "correctiveMeasures": ["Become still, wait, and mark even small voluntary turns.", "Release lead pressure, increase distance, and offer orientation again as a free choice."],
          "regression": "Increase distance from distractions and shorten the session.",
          "progression": "Repeat briefly in a slightly busier setting.",
          "homework": "Once daily, observe quietly for one minute and reward voluntary orientation.",
          "safetyNotes": "Choose enough distance for both dog and handler to remain comfortable.",
          "reviewStatus": "approved"
        }
      }
    },
    {
      "id": "14792a9d-f257-4758-bf3c-b2feb2053d95",
      "version": 2,
      "metadata": {
        "categories": ["marker", "foundation"],
        "difficulty": "foundation",
        "durationMinutes": 4,
        "equipment": ["small food rewards"],
        "safetyLevel": "standard"
      },
      "localizations": {
        "de": {
          "title": "Markersignal aufbauen",
          "goal": "Ein kurzes, gleichbleibendes Signal kündigt zuverlässig eine Belohnung an.",
          "setup": "Ruhiger Ort und zehn kleine Belohnungen.",
          "steps": ["Markersignal einmal geben.", "Unmittelbar danach eine Belohnung reichen.", "Nach kurzer Pause wiederholen, ohne vorher Verhalten zu verlangen."],
          "successCriteria": ["Signal und Belohnung folgen in gleichbleibender Reihenfolge.", "Der Hund bleibt während der kurzen Einheit entspannt."],
          "commonErrors": ["Das Signal mehrfach wiederholen", "Vor der Belohnung zusätzlich Verhalten verlangen"],
          "correctiveMeasures": ["Pro Wiederholung genau ein kurzes Signal geben und danach pausieren.", "Signal unmittelbar belohnen und erst nach stabiler Verknüpfung mit Verhalten kombinieren."],
          "regression": "Weniger Wiederholungen an einem ruhigeren Ort durchführen.",
          "progression": "Das Signal später unmittelbar bei einem einfachen freiwilligen Verhalten einsetzen.",
          "homework": "Eine kurze Serie von fünf Wiederholungen durchführen.",
          "safetyNotes": "Belohnungsgröße an die Tagesration und individuelle Verträglichkeit anpassen.",
          "reviewStatus": "approved"
        },
        "en": {
          "title": "Build a marker cue",
          "goal": "A short, consistent cue reliably predicts a reward.",
          "setup": "A calm location and ten small rewards.",
          "steps": ["Give the marker cue once.", "Immediately deliver one reward.", "Pause briefly and repeat without first requesting a behaviour."],
          "successCriteria": ["Cue and reward occur in a consistent order.", "The dog remains comfortable during the short session."],
          "commonErrors": ["Repeating the cue several times", "Requesting extra behaviour before the reward"],
          "correctiveMeasures": ["Use exactly one short cue per repetition, then pause.", "Reward the cue immediately and only combine it with behaviour after the association is reliable."],
          "regression": "Use fewer repetitions in a quieter location.",
          "progression": "Later apply the cue immediately after a simple voluntary behaviour.",
          "homework": "Complete one short set of five repetitions.",
          "safetyNotes": "Adjust reward size to the daily food allowance and individual tolerance.",
          "reviewStatus": "approved"
        }
      }
    },
    {
      "id": "3924b70c-e805-4792-ab47-34666c7b878c",
      "version": 2,
      "metadata": {
        "categories": ["station", "calmness"],
        "difficulty": "foundation",
        "durationMinutes": 7,
        "equipment": ["non-slip mat", "small food rewards"],
        "safetyLevel": "standard"
      },
      "localizations": {
        "de": {
          "title": "Matte als Ruheort",
          "goal": "Der Hund betritt eine Matte freiwillig und kann dort kurz verweilen.",
          "setup": "Rutschfeste Matte in ruhiger Umgebung auslegen.",
          "steps": ["Jede freiwillige Annäherung an die Matte markieren und belohnen.", "Belohnungen auf oder dicht über der Matte geben.", "Bei sicherem Betreten kurze ruhige Pausen vor der nächsten Belohnung einbauen."],
          "successCriteria": ["Der Hund betritt die Matte freiwillig mit allen Pfoten.", "Der Hund kann mindestens fünf Sekunden entspannt auf der Matte bleiben."],
          "commonErrors": ["Den Hund auf die Matte ziehen", "Die Verweildauer zu schnell verlängern"],
          "correctiveMeasures": ["Leine und Körperdruck lösen und schon freiwillige Annäherungen belohnen.", "Zur letzten entspannten Dauer zurückkehren und nur in kleinen Schritten steigern."],
          "regression": "Größere Matte verwenden und bereits Annäherungen belohnen.",
          "progression": "Abstand zur Matte oder Verweildauer jeweils nur geringfügig erhöhen.",
          "homework": "Die Matte einmal täglich für eine zweiminütige ruhige Einheit auslegen.",
          "safetyNotes": "Eine rutschfeste Unterlage verwenden und den Weg zur Matte freihalten.",
          "reviewStatus": "approved"
        },
        "en": {
          "title": "Mat as a resting station",
          "goal": "The dog voluntarily steps onto a mat and can remain there briefly.",
          "setup": "Place a non-slip mat in a calm environment.",
          "steps": ["Mark and reward each voluntary approach to the mat.", "Deliver rewards on or directly above the mat.", "Once stepping on is reliable, add brief calm pauses before the next reward."],
          "successCriteria": ["The dog voluntarily places all paws on the mat.", "The dog can remain comfortable on the mat for at least five seconds."],
          "commonErrors": ["Pulling the dog onto the mat", "Increasing duration too quickly"],
          "correctiveMeasures": ["Remove lead and body pressure and reward voluntary approaches again.", "Return to the last comfortable duration and increase only in small steps."],
          "regression": "Use a larger mat and reward approaches again.",
          "progression": "Increase either distance or duration in small increments.",
          "homework": "Set out the mat once daily for a calm two-minute session.",
          "safetyNotes": "Use a non-slip surface and keep the route to the mat clear.",
          "reviewStatus": "approved"
        }
      }
    },
    {
      "id": "dd31e7b2-716e-48f8-a6d6-b2d531504832",
      "version": 2,
      "metadata": {
        "categories": ["handling", "cooperation"],
        "difficulty": "foundation",
        "durationMinutes": 5,
        "equipment": ["small food rewards"],
        "safetyLevel": "standard"
      },
      "localizations": {
        "de": {
          "title": "Handtarget",
          "goal": "Der Hund berührt eine ruhig angebotene Hand freiwillig mit der Nase.",
          "setup": "Ruhiger Ort; offene Hand seitlich und mit Abstand zum Gesicht des Hundes anbieten.",